"station_id","station_name","station_address","lat","lon","source","create_year"
"08BEAC0A0232","雲林縣縣立誠正國小","雲林縣水林鄉蘇秦村一號","23.620699","120.2613399","Yunlin19","2019"
"08BEAC0A023E","嘉義縣縣立祥和國小","嘉義縣朴子市祥和二路西段9號","23.4563642","120.2886829","ChiayiCounty19","2019"
"08BEAC0A0246","臺南市市立延平國中","臺南市北區公園路750號","22.98548962","120.2168919","Tainan19","2019"
"08BEAC0A0616","臺南市市立東山國中","臺南市東山區東中里青葉路一段132號","23.31694659","120.4030698","Tainan19","2019"
"74DA38F7C33E","市立指南國小","臺北市文山區指南路三段38巷5-2號","24.976","121.583","Taipei18","2018"
"08BEAC0A0618","臺南市市立復興國中","臺南市東區裕文路62號","22.9753343","120.240635","Tainan19","2019"
"08BEAC0A061A","臺南市市立西埔國小","臺南市南化區西埔里117號","23.04614931","120.4456755","Tainan19","2019"
"08BEAC0A0240","嘉義縣縣立茶山國小","嘉義縣阿里山鄉茶山村三鄰74號","23.30020388","120.6655878","ChiayiCounty19","2019"
"08BEAC0A0658","雲林縣縣立北港國中","雲林縣北港鎮民生路一○二號","23.5668806","120.299355","Yunlin19","2019"
"74DA38F7C368","新北市秀朗國小","N/A","24.998","121.521","NewTaipei18","2018"
"08BEAC0A0292","臺南市市立左鎮國小","臺南市左鎮區中正里7號","23.05596794","120.4041667","Tainan19","2019"
"08BEAC0A0294","雲林縣縣立舊庄國小","雲林縣大埤鄉怡然村怡然路九二號","23.63316893","120.4016321","Yunlin19","2019"
"08BEAC0A0296","雲林縣縣立光復國小","雲林縣虎尾鎮墾地里光復莊11鄰卅九號","23.74082309","120.40158","Yunlin19","2019"
"08BEAC0A029A","雲林縣縣立莿桐國小","雲林縣莿桐鄉莿桐村中正路二○六號","23.757105","120.4986287","Yunlin19","2019"
"74DA38F21028","新竹縣縣立尖石國中","[313]新竹縣尖石鄉嘉樂村三鄰八十號","24.707","121.202","HsinchuCounty","2018"
"74DA38F7C240","新北市新泰國中","N/A","25.042","121.443","NewTaipei18","2018"
"08BEAC0A0248","桃園市市立新埔國小","桃園市桃園區經國路208巷36號","25.01835338","121.3069122","Taoyuan19","2019"
"08BEAC0A0242","臺中市立南屯國小","臺中市南屯區南屯區黎明路一段968號","24.1366745","120.6376493","Taichung19","2019"
"08BEAC0A0244","臺中市立后里國小","臺中市后里區義里里甲后路一段168號","24.3099441528","120.729858398","Taichung19","2019"
"08BEAC0A024A","雲林縣縣立水林國中","雲林縣水林鄉水北村水林路二號","23.57277095","120.2477592","Yunlin19","2019"
"08BEAC0A024C","雲林縣私立維多利亞小學","雲林縣斗六市鎮南路1110號","23.6798001","120.552136","Yunlin19","2019"
"08BEAC0A028E","桃園市市立內柵國小","桃園市大溪區義和里三鄰安和路38號","24.8556076902","121.282213479","Taoyuan19","2019"
"08BEAC0A0290","雲林縣縣立三和國小","雲林縣二崙鄉三和村二鄰十七號","23.750533","120.4082809","Yunlin19","2019"
"74DA38F7C256","新北市新莊國中","N/A","25.035","121.451","NewTaipei18","2018"
"74DA38F7C27E","新北市中平國中","N/A","25.053","121.444","NewTaipei18","2018"
"74DA38F7C344","新北市興福國小","N/A","25.111","121.313","NewTaipei18","2018"
"74DA38F7C34E","新北市後埔國小","N/A","25.003","121.463","NewTaipei18","2018"
"74DA38F7C340","市立福星國小","臺北市萬華區福星里中華路一段66號","25.048","121.548","Taipei18","2018"
"74DA38F7C34A","市立大橋國小","臺北市大同區隆和里重慶北路3段2號","25.064","121.512","Taipei18","2018"
"74DA38F7C370","市立幸安國小","臺北市大安區民炤里仁愛路3段22號","25.036","121.534","Taipei18","2018"
"74DA38F20DA6","苗栗縣育英國小龍騰分校","苗栗縣三義龍騰村鄉外庄49號","24.357","120.776","Miaoli","2018"
"74DA38F20FCE","高雄市市立十全國小","高雄市十全國小 高雄市三民區十全二路162號","22.641","120.343","Kaohsiung18","2018"
"08BEAC0A029C","臺中市立崇倫國中","臺中市南區忠明南路653號","24.13197002","120.6588999","Taichung19","2019"
"74DA38F21070","高雄市市立林園國小","高雄市林園國小 高雄市林園區忠孝西路20號","22.507","120.392","Kaohsiung18","2018"
"08BEAC0A02D8","臺中市立中山國小","臺中市東勢區泰昌里中泰街88號","24.25769279","120.8262096","Taichung19","2019"
"08BEAC0A02DC","臺南市市立林鳳國小","臺南市六甲區中社里林鳳營240號","23.240465","120.3178193","Tainan19","2019"
"08BEAC0A0318","雲林縣縣立鎮東國小","雲林縣斗六市鎮東里文化路二○五號","23.7122373","120.5514754","Yunlin19","2019"
"08BEAC0A031C","臺中市立塗城國小","臺中市大里區仁德里13鄰文化街120號","24.09427801","120.6985297","Taichung19","2019"
"08BEAC0A031E","雲林縣縣立二崙國小","雲林縣二崙鄉崙東村中興路十四號","23.7716238","120.4133025","Yunlin19","2019"
"74DA38F7C2A4","新北市佳林國中","N/A","25.08","121.384","NewTaipei18","2018"
"74DA38F7C30E","新北市桃子腳國中","N/A","24.949","121.382","NewTaipei18","2018"
"74DA38F7C312","新北市新興國小","N/A","25.179","121.44","NewTaipei18","2018"
"74DA38F7C314","新北市插角國小","N/A","24.872","121.405","NewTaipei18","2018"
"74DA38C7CEB4","嘉義市立宣信國小","[600]嘉義市東區宣信街266號","23.47","120.459","Chiayi","2017"
"74DA38F7C302","新北市鶯歌國小","N/A","24.951","121.345","NewTaipei18","2018"
"74DA38F7C316","新北市建安國小","N/A","25.062","121.451","NewTaipei18","2018"
"74DA38F7C326","新北市尖山國中","N/A","24.943","121.342","NewTaipei18","2018"
"74DA38F7C328","新北市龍埔國小","N/A","24.941","121.377","NewTaipei18","2018"
"74DA38F7C334","新北市昌福國小","N/A","24.955","121.339","NewTaipei18","2018"
"74DA38F7C338","新北市板橋國小","N/A","25.011","121.458","NewTaipei18","2018"
"74DA38F7C33C","新北市文德國小","N/A","25.022","121.459","NewTaipei18","2018"
"08BEAC0A0828","臺南市市立光復生態實驗小學","臺南市七股區塩埕里塩埕1號","23.14965152","120.1067805","Tainan19","2019"
"08BEAC0A0260","臺南市市立仙草國小","臺南市白河區仙草里22號","23.3450457167","120.473828875","Tainan19","2019"
"08BEAC0A0620","桃園市市立新莊國小","桃園市蘆竹區大新路380巷121號","25.02773493","121.2466369","Taoyuan19","2019"
"08BEAC0A060A","臺南市市立安順國小","臺南市安南區安和路三段193號","23.0457703","120.2135861","Tainan19","2019"
"74DA38F7C310","新北市忠義國小","N/A","25.09","121.464","NewTaipei18","2018"
"08BEAC0A0622","雲林縣縣立華山國小","雲林縣古坑鄉華山村四一號","23.5953486","120.5967026","Yunlin19","2019"
"74DA38F20E6C","苗栗縣縣立武榮國小","[364]苗栗縣大湖鄉義和村淋漓坪77號","24.382","120.867","Miaoli","2018"
"74DA38F21056","台東縣縣立豐榮國小","[950]臺東縣臺東市中華路二段154巷150號","22.747","121.136","Taitung","2018"
"08BEAC0A0624","嘉義縣縣立新港國中","嘉義縣新港鄉福德村福德路106號","23.557845","120.343112","ChiayiCounty19","2019"
"74DA38F207FA","高雄市市立登發國小","高雄市登發國小 高雄市仁武區仁和里仁忠路191號","22.679","120.354","Kaohsiung18","2018"
"08BEAC0A0738","臺南市市立成功國中","臺南市北區和緯路一段2號","22.98548962","120.2168919","Tainan19","2019"
"74DA38F20ECE","屏東縣縣立佳冬國中","[931]屏東縣佳冬鄉玉光村大同路1號","22.428","120.566","Pingtung","2018"
"74DA38F20850","台東縣縣立加拿國小","[957]臺東縣海端鄉加拿村加南5號","23.001","121.13","Taitung","2018"
"74DA38F20D78","基隆市立中華國小","[203]基隆市中山區中華路46巷26號","25.148","121.738","Keelung","2018"
"74DA38F20852","苗栗縣縣立中正國小","[358]苗栗縣苑裡鎮中正里111號","24.428","120.661","Miaoli","2018"
"74DA38F20D7A","高雄市市立忠孝國中","高雄市立忠孝國民中學 高雄市鳳山區國泰路二段81號","22.62","120.346","Kaohsiung18","2018"
"74DA38F7C43C","新北市義方國小","N/A","25.113","121.802","NewTaipei18","2018"
"08BEAC0A0626","臺南市市立新化國小","臺南市新化區中山路173號","23.0375752","120.3110539","Tainan19","2019"
"08BEAC0A02F4","臺中市立大忠國小","臺中市大肚區社腳里沙田路一段八五四巷二四號","24.13430025","120.55636","Taichung19","2019"
"08BEAC0A0178","桃園市市立八德國中","桃園市八德區興豐路321號","24.93494833","121.3029933","Taoyuan19","2019"
"74DA38F21052","高雄市市立勝利國小","高雄市勝利國小 高雄市左營區南屏路1號","22.671","120.295","Kaohsiung18","2018"
"74DA38F208A6","苗栗縣縣立明德國小","[362]苗栗縣頭屋鄉明德村明德路4巷13號","24.585","120.885","Miaoli","2018"
"08BEAC0A0332","嘉義縣縣立柳溝國小","嘉義縣溪口鄉柳溝村南靖厝5號","23.57717224","120.4143791","ChiayiCounty19","2019"
"08BEAC0A032A","雲林縣私立東南代用國中","雲林縣西螺鎮西興路一五二號","23.80310738","120.4518142","Yunlin19","2019"
"08BEAC0A0628","嘉義縣縣立月眉國小","嘉義縣新港鄉月眉村20鄰123號","23.52004522","120.3507122","ChiayiCounty19","2019"
"08BEAC0A017A","桃園市市立大崗國中","桃園市龜山區文化里文化二路168號","25.052328","121.3712446","Taoyuan19","2019"
"74DA38F211B0","屏東縣縣立潮東國小","[920]屏東縣潮州鎮九塊里復興路66號","22.522","120.56","Pingtung","2018"
"74DA38F7C60E","市立新生國小","臺北市大安區新生南路二段36號","25.029","121.532","Taipei18","2018"
"08BEAC0A062A","桃園市中壢家商","桃園巿中壢區德育路36號","24.95341333","121.2197766","Taoyuan19","2019"
"74DA38F2086E","台東縣縣立東海國小","[950]臺東縣臺東市長沙街329號","22.752","121.14","Taitung","2018"
"74DA38F20882","宜蘭縣大同國小樂水分校","[267]宜蘭縣大同鄉樂水村碼崙巷53號","24.6","121.529","Ilan","2018"
"08BEAC0A017C","桃園市市立幸福國中","桃園市龜山區中興路100巷20號","24.98786151","121.3322299","Taoyuan19","2019"
"08BEAC0A0330","臺中市立瑞井國小","臺中市大肚區瑞井里華山路680號","24.15980984","120.5659126","Taichung19","2019"
"74DA38F7C634","新北市二橋國小","N/A","24.941","121.336","NewTaipei18","2018"
"74DA38F20888","宜蘭縣縣立冬山國小","[269]宜蘭縣冬山鄉安平村安中路35號","24.632","121.789","Ilan","2018"
"74DA38F7C63C","新北市文林國小","N/A","24.998","121.425","NewTaipei18","2018"
"74DA38F208A8","苗栗縣縣立頭屋國小","[362]苗栗縣頭屋鄉頭屋村中山街15號","24.576","120.851","Miaoli","2018"
"08BEAC0A062C","雲林縣縣立鎮西國小","雲林縣斗六市中和里西平路三號","23.7073903","120.5384094","Yunlin19","2019"
"08BEAC0A062E","雲林縣縣立東勢國中","雲林縣東勢鄉東榮路六五號","23.673242","120.2564741","Yunlin19","2019"
"08BEAC0A0632","雲林縣縣立臺興國小","雲林縣口湖鄉台子村台興路一二五號","23.56244444","120.1420962","Yunlin19","2019"
"08BEAC0A063A","嘉義縣縣立大同國小","嘉義縣朴子市大同路239號","23.461271","120.240491","ChiayiCounty19","2019"
"08BEAC0A071A","臺南市市立南寧高中附設國中","臺南市南區萬年路167號","22.96416651","120.2344983","Tainan19","2019"
"74DA38ED05FA","花蓮縣立松浦國小","[981]花蓮縣玉里鎮松浦里12鄰212號","23.466","121.405","Hualien","2018"
"74DA38F207E4","苗栗縣縣立南河國小","[363]苗栗縣公館鄉南河村二鄰21號","24.531","120.853","Miaoli","2018"
"08BEAC0A0770","臺南市市立崇學國小","臺南市東區崇學路98號","22.97956447","120.2235883","Tainan19","2019"
"08BEAC09FF36","雲林縣縣立廉使國小","雲林縣虎尾鎮廉使里卅二號","23.71716907","120.4206033","Yunlin19","2019"
"08BEAC0A063C","桃園市市立水美國小","桃園市楊梅區水美里楊新路一段410號","24.9191608429","121.137031555","Taoyuan19","2019"
"08BEAC0A0094","桃園市市立青溪國中","桃園市桃園區中山東路124號","24.99677181","121.3198864","Taoyuan19","2019"
"08BEAC0A0650","臺南市市立進學國小","臺南市中西區南寧街47號","22.9848253603","120.203317031","Tainan19","2019"
"08BEAC09FF4C","臺中市立福民國小","臺中市新社區福興里福民16之7號","24.15948701","120.8643162","Taichung19","2019"
"08BEAC0A0372","臺南市市立口埤實驗小學","臺南市新化區知義里口埤88號","23.02539545","120.3489531","Tainan19","2019"
"08BEAC0A0778","臺南市市立開元國小","臺南市北區勝安里開元路71巷32號","23.0024229","120.2223212","Tainan19","2019"
"08BEAC0A037A","臺中市立大墩國小","臺中市南屯區向上路二段201號","24.1466638","120.6391771","Taichung19","2019"
"08BEAC0A03B6","雲林縣縣立南陽國小","雲林縣北港鎮南安里光明路五九號","23.566488266","120.300987244","Yunlin19","2019"
"08BEAC0A03E2","臺中市立南陽國小","臺中市豐原區南陽路440號","24.24840196","120.7243085","Taichung19","2019"
"08BEAC0A0666","雲林縣縣立林厝國小","雲林縣四湖鄉林東村中華路一號","23.6691334","120.1788179","Yunlin19","2019"
"08BEAC0A0668","嘉義縣縣立義仁國小","嘉義縣竹崎鄉義和村山子門22號","23.50851533","120.4993512","ChiayiCounty19","2019"
"08BEAC0A063E","嘉義縣縣立竹村國小","嘉義縣朴子市竹村里36號","23.43553724","120.2417302","ChiayiCounty19","2019"
"08BEAC09FF58","臺中市立光復國小","臺中市中區三民路二段148號","24.166959","120.678557","Taichung19","2019"
"74DA38C7D604","新竹市立科園國小","[300]新竹市東區科學園路171號","24.781","121.012","Hsinchu","2017"
"74DA38C7D616","新竹市立培英國中","[300]新竹市東區學府路4號","24.794","120.978","Hsinchu","2017"
"08BEAC09FF50","臺中市立軍功國小","臺中市北屯區軍福十三路300號","24.17372166","120.7198433","Taichung19","2019"
"08BEAC09FF52","臺中市立臺中高工","臺中市南區高工路191號","24.1136594874","120.661511086","Taichung19","2019"
"08BEAC0A03BC","雲林縣縣立林中國小","雲林縣林內鄉林中村公園路四號","23.7548738","120.6149259","Yunlin19","2019"
"08BEAC0A0642","臺南市市立玉井國中","臺南市玉井區大成路152號","23.12322398","120.4703638","Tainan19","2019"
"08BEAC0A071C","臺南市市立安定區南興國小","臺南市安定區六嘉里30號","23.0989532471","120.224700928","Tainan19","2019"
"08BEAC0A071E","臺南市市立竹橋國小","臺南市七股區竹橋里130號","23.10165509","120.1587103","Tainan19","2019"
"08BEAC0A0644","臺南市市立鹽水國中","臺南市鹽水區三福路63號","23.3217438","120.2635574","Tainan19","2019"
"08BEAC0A0380","嘉義縣縣立六美國小","嘉義縣六腳鄉六斗村31號","23.54010674","120.2930181","ChiayiCounty19","2019"
"08BEAC0A03B4","臺南市市立文賢國中","臺南市北區文賢一路2號","23.0055139","120.1965893","Tainan19","2019"
"08BEAC0A0648","桃園市市立南崁國中","桃園市蘆竹區五福六路1號","25.0545296021","121.298049912","Taoyuan19","2019"
"08BEAC0A03BE","桃園市市立楊心國小","桃園市楊梅區金華街100號","24.91233771","121.1428553","Taoyuan19","2019"
"74DA38C7D618","新竹華德福實驗學校","[300]新竹市香山區中華路6段331巷168號","24.741","120.913","Hsinchu","2017"
"74DA38F7C630","新北市建國國小","N/A","24.954","121.346","NewTaipei18","2018"
"08BEAC0A0716","桃園市市立平鎮國中","桃園市平鎮區新富里振興路2號","24.9452641","121.2182544","Taoyuan19","2019"
"08BEAC0A0718","嘉義縣縣立北回國小","嘉義縣水上鄉三和村榮典路新厝仔1之1號","23.4536177","120.4097879","ChiayiCounty19","2019"
"74DA38C7D652","新竹市立關東國小","[300]新竹市東區關東路53號","24.784","121.022","Hsinchu","2017"
"08BEAC09FF54","臺中市立三光國中","臺中市北屯區三光一街77號","24.16756409","120.6980819","Taichung19","2019"
"08BEAC09FF5A","臺南市市立南區新興國小","臺南市南區新興路22號","22.9795065","120.196457","Tainan19","2019"
"08BEAC0A064A","雲林縣縣立和安國小","雲林縣水林鄉溪漧村四一號","23.57482016","120.245887","Yunlin19","2019"
"08BEAC0A0720","臺南市市立二溪國小","臺南市大內區二溪里154號","23.12225617","120.3929318","Tainan19","2019"
"08BEAC0A03FE","臺中市立樹義國小","臺中市南區福田路11號","24.11108493","120.6569166","Taichung19","2019"
"08BEAC0A0400","臺中市立忠明國小","臺中市西區臺灣大道二段556號","24.1584500516","120.659557767","Taichung19","2019"
"08BEAC0A0402","臺中市立進德國小","臺中市東區東勢里進化路135號","24.14498002","120.6938252","Taichung19","2019"
"08BEAC0A0654","桃園市市立大安國小","桃園市八德區大安里和平路638號","24.95684166","121.3155","Taoyuan19","2019"
"08BEAC0A0722","桃園市市立光華國小","桃園市復興區華陵里四鄰12號","24.655345","121.3995733","Taoyuan19","2019"
"08BEAC0A0724","臺南市市立正新國小","臺南市新化區豐榮里正新路97號","23.03327523","120.301495","Tainan19","2019"
"08BEAC0A0726","嘉義縣縣立水上國中","嘉義縣水上鄉水上村進學街45號","23.42573349","120.3948068","ChiayiCounty19","2019"
"08BEAC0A0732","臺南市市立玉豐國小","臺南市白河區玉豐里85號","23.3793211029","120.416117124","Tainan19","2019"
"08BEAC09FF5C","臺中市立長億高中","臺中市太平區長億六街一號","24.11323853","120.7217441","Taichung19","2019"
"74DA38F20964","苗栗縣縣立文峰國小","[366]苗栗縣銅鑼鄉樟樹村12之1號","24.464","120.785","Miaoli","2018"
"74DA38F210E0","屏東縣私立南榮國中","[924]屏東縣崁頂鄉園寮村田寮路1之15號","22.513","120.518","Pingtung","2018"
"08BEAC0A034E","桃園市市立龍星國小","桃園市龍潭區中正路269號","24.8627729","121.2180092","Taoyuan19","2019"
"08BEAC0A035C","臺中市立土牛國小","臺中市石岡區土牛里豐勢路308號","24.2655249581","120.808502175","Taichung19","2019"
"08BEAC0A035E","嘉義縣縣立南興國小","嘉義縣義竹鄉新店村77號","23.34168438","120.192098","ChiayiCounty19","2019"
"08BEAC0A04B0","嘉義縣縣立松梅國小","嘉義縣朴子市松華里345號","23.41088606","120.2508637","ChiayiCounty19","2019"
"08BEAC0A0360","臺中市立何厝國小","臺中市西屯區重慶路1號","24.1635155428","120.653961003","Taichung19","2019"
"08BEAC0A0364","臺中市立龍港國小","臺中市龍井區麗水里三港路1號","24.19858441","120.5011919","Taichung19","2019"
"08BEAC0A036E","臺中市立惠文國小","臺中市南屯區公益路二段300號","24.1520526662","120.638278462","Taichung19","2019"
"08BEAC0A03C4","嘉義縣縣立太平國小","嘉義縣梅山鄉太平村4號","23.5609424","120.6064319","ChiayiCounty19","2019"
"08BEAC0A04F0","臺南市市立中西區成功國小","臺南市北區文賢ㄧ路2號(文賢國中)","23.1421146","120.1420138","Tainan19","2019"
"08BEAC0A0530","雲林縣縣立新生國小","雲林縣元長鄉瓦搖村新生路十一號","23.63780915","120.3590977","Yunlin19","2019"
"08BEAC0A0532","臺南市市立北勢國小","臺南市麻豆區北勢里15號","23.20546338","120.2402751","Tainan19","2019"
"08BEAC0A0534","嘉義縣縣立柳林國小","嘉義縣水上鄉柳林村92號","23.43568913","120.415497","ChiayiCounty19","2019"
"08BEAC0A0538","臺南市市立新東國中","臺南市新營區民治東路30號","23.31190196","120.324114","Tainan19","2019"
"08BEAC0A053A","臺南市市立學甲國中","臺南市學甲區華宗路540號","23.2371735","120.1839039","Tainan19","2019"
"08BEAC0A053E","嘉義縣縣立成功國小","嘉義縣水上鄉三界村153號","23.432459","120.475488","ChiayiCounty19","2019"
"08BEAC0A0540","臺南市市立西門實驗小學","臺南市安平區安北路180號","23.0027769","120.1592178","Tainan19","2019"
"08BEAC0A0544","臺南市市立沙崙國中","臺南市歸仁區武東里歸仁六路2號","22.92912324","120.281771","Tainan19","2019"
"08BEAC0A0508","臺南市市立茄拔國小","臺南市善化區嘉北里280號","23.13865101","120.3244124","Tainan19","2019"
"08BEAC0A0512","臺南市市立大港國小","臺南市北區大港街146號","23.0135245","120.1892436","Tainan19","2019"
"08BEAC0A0546","桃園市市立富岡國小","桃園市楊梅區豐野里中正路147號","24.93736722","121.0804053","Taoyuan19","2019"
"08BEAC0A054A","桃園市市立南興國小","桃園市大溪區仁和路二段135號","24.90266468","121.2667367","Taoyuan19","2019"
"08BEAC0A0640","臺南市市立信義國小","臺南市佳里區忠仁里信義一街336號","23.1600376","120.1822186","Tainan19","2019"
"08BEAC0A054C","臺南市市立大橋國中","臺南市永康區東橋十街1號","23.02020007","120.2270599","Tainan19","2019"
"74DA38F7C408","新北市三重商工","N/A","25.069","121.481","NewTaipei18","2018"
"74DA38F7C40A","新北市青潭國小","N/A","24.953","121.552","NewTaipei18","2018"
"08BEAC0A0450","臺中市立新興國小","臺中市北屯區新興路20號","24.19464026","120.6623838","Taichung19","2019"
"08BEAC0A054E","臺南市市立西港區成功國小","臺南市西港區竹林里11號","23.12138","120.1806293","Tainan19","2019"
"08BEAC0A04DE","雲林縣縣立義賢國小","雲林縣二崙鄉楊賢村楊賢路一號","23.8171254","120.413931","Yunlin19","2019"
"08BEAC0A04E2","桃園市市立瑞祥國小","桃園市大溪區瑞源里石園路760巷120號","24.86822898","121.2524869","Taoyuan19","2019"
"08BEAC0A0526","嘉義縣縣立嘉新國中","嘉義縣太保市中山路一段586巷7號","23.500389","120.378001","ChiayiCounty19","2019"
"08BEAC0A052A","臺南市市立麻豆國中","臺南市麻豆區南勢里36號","23.1828117371","120.259864807","Tainan19","2019"
"08BEAC0A052C","嘉義縣縣立梅北國小","嘉義縣梅山鄉梅北村民生街1號","23.5873308376","120.552114509","ChiayiCounty19","2019"
"08BEAC09FF1A","桃園市市立中正國小","桃園市中壢區榮民路329號","24.96187166","121.26277","Taoyuan19","2019"
"08BEAC09FF1C","雲林縣縣立安慶國小","雲林縣虎尾鎮民主路卅六號","23.7029334","120.4333605","Yunlin19","2019"
"08BEAC0A067A","雲林縣縣立公誠國小","雲林縣斗六市鎮北里北平路九五號","23.715242","120.5388144","Yunlin19","2019"
"08BEAC0A067C","桃園市市立龍源國小","桃園市龍潭區龍源路121巷110弄39號","24.8259920302","121.212042533","Taoyuan19","2019"
"08BEAC0A067E","桃園市市立高原國小","桃園市龍潭區高原里高原路568號","24.83050995","121.1949524","Taoyuan19","2019"
"08BEAC0A0680","桃園市市立文昌國中","桃園市桃園區民生路729號","25.0101324","121.3076088","Taoyuan19","2019"
"08BEAC09FF1E","臺中市立東新國中","臺中市東勢區東新里東環街123號","24.26335737","120.829858","Taichung19","2019"
"08BEAC09FF3E","雲林縣縣立文安國小","雲林縣斗南鎮延平路一段一八九號","23.6916177","120.4811326","Yunlin19","2019"
"74DA38F7C40C","新北市秀山國小","N/A","24.995","121.52","NewTaipei18","2018"
"74DA38F7C410","新北市三民高中","N/A","25.086","121.473","NewTaipei18","2018"
"74DA38F7C41C","市立永樂國小","臺北市大同區南芳里延平北路2段266號","25.061","121.51","Taipei18","2018"
"08BEAC0A05BE","臺南市市立樹林國小","臺南市七股區樹林里65之11號","23.11139843","120.1545077","Tainan19","2019"
"08BEAC0A05C0","桃園市市立菓林國小","桃園市大園區菓林里十二鄰崁下41號","25.07764365","121.2560332","Taoyuan19","2019"
"08BEAC0A05C2","臺南市市立歸仁國中","臺南市歸仁區文化里文化街二段2號","22.96989997","120.293886","Tainan19","2019"
"08BEAC0A05C6","雲林縣縣立興南國小","雲林縣口湖鄉埔南村九號","23.6003226","120.1909071","Yunlin19","2019"
"08BEAC0A060E","桃園市市立錦興國小","桃園市蘆竹區南竹路一段100號","25.046729913","121.289672367","Taoyuan19","2019"
"08BEAC0A0610","桃園市市立楊明國小","桃園市楊梅區中山北路一段390巷50號","24.9113853035","121.158530451","Taoyuan19","2019"
"08BEAC0A0612","嘉義縣縣立忠和國中","嘉義縣水上鄉忠和村6之2號","23.4252309","120.4514224","ChiayiCounty19","2019"
"08BEAC0A0614","桃園市市立同德國中","桃園市桃園區南平路487號","25.0158367","121.2936759","Taoyuan19","2019"
"08BEAC0A061E","嘉義縣縣立溪口國中","嘉義縣溪口鄉坪頂村中正東路103號","23.60394623","120.3939419","ChiayiCounty19","2019"
"08BEAC0A0664","桃園市市立武漢國中","桃園市龍潭區武中路227號","24.87972449","121.2316321","Taoyuan19","2019"
"08BEAC0A066E","桃園市市立龍潭國小","桃園市龍潭區龍潭里南龍路13號","24.8636884","121.2133944","Taoyuan19","2019"
"08BEAC0A0672","雲林縣縣立蔦松國中","雲林縣水林鄉松北路一之一號","23.52175533","120.2295041","Yunlin19","2019"
"08BEAC0A0674","嘉義縣縣立蒜頭國小","嘉義縣六腳鄉蒜頭村188號","23.50105253","120.2919202","ChiayiCounty19","2019"
"08BEAC0A0676","臺南市市立港東國小","臺南市西港區港東里雙張廍1之1號","23.12258295","120.2094261","Tainan19","2019"
"08BEAC0A0678","臺南市市立七股國小","臺南市七股區大埕里395號","23.13947594","120.1381512","Tainan19","2019"
"74DA38F7C416","市立河堤國小","臺北市中正區汀州路二段180號","25.025","121.514","Taipei18","2018"
"74DA38F7C41A","市立蓬萊國小","臺北市大同區星明里寧夏路35號","25.083","121.462","Taipei18","2018"
"08BEAC0A06F8","臺南市市立中山國中","臺南市中西區南寧街45號","22.983984","120.202863","Tainan19","2019"
"08BEAC0A0782","雲林縣縣立和平國小","雲林縣元長鄉子茂村四號","23.658634","120.3361468","Yunlin19","2019"
