"station_id","station_name","station_address","lat","lon","source","create_year"
"74DA38C7D58E","新竹市立富禮國中",,,,"Hsinchu","2017"
"08BEAC0A033A","雲林縣縣立馬光國中","雲林縣土庫鎮馬光里和平街一○一號","23.6940568","120.3568767","Yunlin19","2019"
"74DA38F20A0C","高雄市市立七賢國小","高雄市七賢國小 高雄市新興區七賢一路393號","22.634","120.306","Kaohsiung18","2018"
"74DA38F7C37A","市立民族國小","臺北市松山區民生東路4段97巷7號","25.059","121.551","Taipei18","2018"
"74DA38F20EC8","高雄市市立紅毛港國小","高雄市紅毛港國小 高雄市前鎮區明鳳7街1號","22.583","120.334","Kaohsiung18","2018"
"74DA38F20ABC","台東縣縣立月眉國小","[956]臺東縣關山鎮月眉里盛豐路二鄰1號","23.009","121.147","Taitung","2018"
"08BEAC09FFB6","雲林縣縣立橋頭國小","雲林縣麥寮鄉橋頭村仁德路二四八號","23.7981503","120.2729719","Yunlin19","2019"
"74DA38F7C4BA","臺北市備品","臺北市","25.001","121.524","Backup2018","2018"
"74DA38F20A82","苗栗縣縣立僑樂國小","[361]苗栗縣造橋鄉錦水村十二鄰306號","24.603","120.886","Miaoli","2018"
"74DA38F21146","高雄市仁武特殊教育學校","仁武特殊教育學校","22.683","120.346","Kaohsiung18","2018"
"74DA38EBF8C2","花蓮縣立宜昌國中","[973]花蓮縣吉安鄉宜昌1街41號","23.972","121.587","Hualien","2018"
"74DA38F20B12","高雄市市立多納國小","高雄市多納國小 高雄市茂林區多納里1-2號","22.91","120.716","Kaohsiung18","2018"
"74DA38F7C406","新北市中和國小","N/A","24.999","121.501","NewTaipei18","2018"
"74DA38F20F1A","高雄市市立建國國小","高雄市建國國小 高雄市前金區自立二路111號","22.635","120.298","Kaohsiung18","2018"
"74DA38F209C8","屏東縣縣立長興國小","[908]屏東縣長治鄉新潭村潭頭路50號","22.677","120.526","Pingtung","2018"
"74DA38F210C8","屏東縣縣立塔樓國小","[905]屏東縣里港鄉塔樓村塔樓路21之3號","22.765","120.483","Pingtung","2018"
"08BEAC0A0470","桃園市市立瑞梅國小","桃園市楊梅區梅溪里19鄰三民北路26巷41號","24.91027731","121.1713391","Taoyuan19","2019"
"08BEAC0A04A0","臺南市市立甲中國小","臺南市下營區紅甲里71號","23.2501873824","120.272551216","Tainan19","2019"
"74DA38C7D57E","新竹市立內湖國中",,,,"Hsinchu","2017"
"74DA38C7D57C","新竹市立虎林國中",,,,"Hsinchu","2017"
"74DA38B053F6","新竹市立新科國中",,,,"Hsinchu","2017"
"74DA38B053E6","新竹市立香山高中附設國中",,,,"Hsinchu","2017"
"08BEAC0A0386","臺中市立文山國小","臺中市南屯區南屯區文山里忠勇路97號","24.1496395","120.6153841","Taichung19","2019"
"08BEAC0A0858","嘉義縣縣立社團國小","嘉義縣大林鎮三角里下林頭51號","23.6175211","120.4958474","ChiayiCounty19","2019"
"74DA38F20C20","高雄市市立陽明國中","高雄市立陽明國民中學 高雄市三民區本上里義華路166號","22.643","120.34","Kaohsiung18","2018"
"08BEAC0A01C2","嘉義縣縣立內埔國小","嘉義縣竹崎鄉內埔村元興路2號","23.530647","120.520453","ChiayiCounty19","2019"
"74DA38C7CEA6","嘉義市立蘭潭國小","[600]嘉義市東區小雅路419號","23.474","120.47","Chiayi","2017"
"74DA38C7D51A","新竹市立茄苳國小","[300]新竹市香山區茄苳里茄苳路70號","24.755","120.945","Hsinchu","2017"
"74DA38ED04AC","花蓮縣立平和國小","[974]花蓮縣壽豐鄉平和路34號","23.884","121.519","Hualien","2018"
"74DA38ED04BE","花蓮縣立光華國小","[973]花蓮縣吉安鄉光華村光華二街180號","23.935","121.578","Hualien","2018"
"74DA38F20934","台東縣縣立泰源國中","[959]臺東縣東河鄉北源村3鄰30號","23.002","121.29","Taitung","2018"
"74DA38F20938","新竹縣縣立芎林國中","[307]新竹縣芎林鄉新鳳村74號","24.761","121.092","HsinchuCounty","2018"
"74DA38F20A12","高雄市市立油廠國小","高雄市油廠國小 高雄市楠梓區左楠路4號","22.709","120.302","Kaohsiung18","2018"
"08BEAC0A0388","臺南市市立後壁國小","臺南市後壁區後壁里195號","23.3663091336","120.366071127","Tainan19","2019"
"08BEAC0A0472","臺南市市立文正國小","臺南市麻豆區南勢里86號","23.18719587","120.2660892","Tainan19","2019"
"74DA38F20C22","高雄市市立大社國中","高雄市立大社國民中學 高雄市大社區神農里翠屏路100號","22.729","120.357","Kaohsiung18","2018"
"74DA38F20D24","高雄市市立潮寮國中","高雄市立潮寮國民中學 高雄市大寮區潮寮里潮寮路51-9號","22.564","120.424","Kaohsiung18","2018"
"08BEAC0A01C8","雲林縣縣立大新國小","雲林縣西螺鎮大新里二一五號","23.78937457","120.4863166","Yunlin19","2019"
"08BEAC0A04A2","雲林縣縣立土庫國中","雲林縣土庫鎮復興路十六號","23.6867888","120.388553","Yunlin19","2019"
"74DA38F20AFA","屏東縣縣立內獅國小","[943]屏東縣獅子鄉內獅村1號","22.304","120.643","Pingtung","2018"
"08BEAC0A01CC","雲林縣縣立水碓國小","雲林縣古坑鄉水碓村九七號","23.6627953","120.5640955","Yunlin19","2019"
"08BEAC0A039C","臺中市立外埔國中","臺中市外埔區大同里外埔路999號","24.33219096","120.648977","Taichung19","2019"
"08BEAC0A0476","雲林縣縣立古坑國小","雲林縣古坑鄉朝陽路三號","23.6451428","120.5656985","Yunlin19","2019"
"74DA38F7C56C","新北市中信國小","N/A","25.056","121.448","NewTaipei18","2018"
"74DA38F7C57C","新北市豐年國小","N/A","25.03","121.443","NewTaipei18","2018"
"74DA38C7D5FE","新竹市立大湖國小","[300]新竹市香山區大湖里五福路一段530號","24.745","120.933","Hsinchu","2017"
"74DA38F7C584","新北市萬里國小","N/A","25.062","121.451","NewTaipei18","2018"
"74DA38ED0596","花蓮縣立見晴國小","[979]花蓮縣萬榮鄉見晴村89號","23.783","121.451","Hualien","2018"
"74DA38F20C86","高雄市市立水寮國小","高雄市水寮國小 高雄市大樹區水寮里中華路國小巷1號","22.667","120.407","Kaohsiung18","2018"
"74DA38F20BA2","苗栗縣縣立大倫國中","[360]苗栗縣苗栗市玉清里育英街82號","24.569","120.83","Miaoli","2018"
"74DA38F20BBA","高雄市市立旗津國小","高雄市旗津國小 高雄市旗津區中洲三路623號","22.608","120.271","Kaohsiung18","2018"
"74DA38F7C592","新北市金山高中","N/A","25.224","121.637","NewTaipei18","2018"
"74DA38F2085C","台東縣縣立朗島國小","[952]臺東縣蘭嶼鄉朗島村17號","22.079","121.528","Taitung","2018"
"74DA38F20898","苗栗縣縣立啟文國小","[360]苗栗縣苗栗市福星里啟賢街61號","24.573","120.827","Miaoli","2018"
"08BEAC09FF5E","臺中市立豐田國小","臺中市豐原區田心路二段290號","24.23750147","120.7218282","Taichung19","2019"
"74DA38F20AAC","台東縣縣立瑞豐國小","[955]臺東縣鹿野鄉瑞豐村中山路67號","22.978","121.137","Taitung","2018"
"74DA38F208AE","台東縣縣立興隆國小","[959]臺東縣東河鄉興昌村155號","22.895","121.248","Taitung","2018"
"08BEAC0A03D2","桃園市市立僑愛國小","桃園市大溪區仁義里介壽路214號","24.920825","121.2918322","Taoyuan19","2019"
"74DA38F20AC4","基隆市立隆聖國小","[204]基隆市安樂區武隆街107號","25.155","121.694","Keelung","2018"
"74DA38F20C16","高雄市市立光榮國小","高雄市光榮國小 高雄市鹽埕區大智路150號","22.623","120.286","Kaohsiung18","2018"
"74DA38B05396","嘉義私立宏仁女中","[600]嘉義市東區忠孝路667號","23.506","120.445","Chiayi","2017"
"08BEAC0A042A","臺中市立西屯國小","臺中市西屯區西屯路二段300號","24.179497","120.640677","Taichung19","2019"
"08BEAC0A002E","臺中市立大元國小","臺中市大里區現岱路60號","24.10036882","120.6899251","Taichung19","2019"
"08BEAC0A042E","桃園市市立永順國小","桃園市桃園區永順街100號","25.00851452","121.297329","Taoyuan19","2019"
"08BEAC0A0030","臺中市立潭陽國小","臺中市潭子區潭陽路19號","24.21252","120.7099783","Taichung19","2019"
"08BEAC0A0430","桃園市市立楊光國(中)小","桃園市楊梅區瑞溪路一段88號","24.9067090397","121.168344319","Taoyuan19","2019"
"74DA38C7D388","嘉義市立僑平國小","[600]嘉義市西區德安路10號","23.484","120.432","Chiayi","2017"
"08BEAC0A016E","雲林縣縣立大埤國小","雲林縣大埤鄉南和村中正路廿三號","23.6444244","120.4316231","Yunlin19","2019"
"74DA38C7D51C","新竹市立朝山國小","[300]新竹市香山區中華路五段648巷126號","24.765","120.913","Hsinchu","2017"
"74DA38F2093A","連江縣縣立中山國中","[210]連江縣北竿鄉芹壁村84號","26.224","119.98","Matsu","2018"
"74DA38F20FFC","高雄市市立鳳雄國小","高雄市鳳雄國小 高雄市燕巢區鳳加路52號","22.753","120.358","Kaohsiung18","2018"
"08BEAC0A0854","臺南市市立新民國小","臺南市新營區公園路一段136號","23.3055469506","120.305803567","Tainan19","2019"
"08BEAC0A089E","臺南市市立玉井國小","臺南市玉井區中正路1號","23.12125929","120.4587371","Tainan19","2019"
"74DA38F20FFE","高雄市市立中路國小","高雄市中路國小 高雄市阿蓮區中路里272號","22.894","120.298","Kaohsiung18","2018"
"74DA38C7D648","新竹市立新竹國小","[300]新竹市東區興學街106號","24.796","120.966","Hsinchu","2017"
"74DA38F21000","高雄市市立三埤國小","高雄市三埤國小 高雄市路竹區民權路7號","22.837","120.28","Kaohsiung18","2018"
"74DA38F21048","高雄市市立鳳翔國小","高雄市鳳翔國小 高雄市鳳山區鳳育路63號","22.595","120.341","Kaohsiung18","2018"
"74DA38C7D38A","嘉義市立嘉北國小","[600]嘉義市東區嘉北街65號","23.493","120.454","Chiayi","2017"
"74DA38F2090E","屏東縣縣立東港高中附設國中","[928]屏東縣東港鎮船頭路1號","22.465","120.455","Pingtung","2018"
"74DA38F20AEE","高雄市市立中崙國中","高雄市立中崙國民中學 高雄市鳳山區中榮里中崙二路487號","22.488","120.489","Kaohsiung18","2018"
"74DA38F20A04","苗栗縣縣立信義國小","[351]苗栗縣頭份市後庄里信中路36號","24.697","120.891","Miaoli","2018"
"74DA38F207E0","苗栗縣縣立興隆國小","[366]苗栗縣銅鑼鄉興隆村117號","24.462","120.811","Miaoli","2018"
"74DA38F7C59C","市立福安國中","臺北市士林區福安里延平北路七段250號","25.103","121.487","Taipei18","2018"
"74DA38F207E2","苗栗縣縣立銅鑼國小","[366]苗栗縣銅鑼鄉福興村文化街1號","24.49","120.791","Miaoli","2018"
"74DA38F207E8","苗栗縣縣立建功國小","[360]苗栗縣苗栗市中正路241號","24.564","120.824","Miaoli","2018"
"74DA38F2093C","新竹縣縣立峨眉國中","[315]新竹縣峨眉鄉峨眉街十鄰54號","25.062","121.451","HsinchuCounty","2018"
"74DA38F20944","新竹縣縣立新豐國中","[304]新竹縣新豐鄉成德街36號","24.902","120.991","HsinchuCounty","2018"
"74DA38F2104C","高雄市市立金山國小","高雄市金山國小 高雄市燕巢區金山里番田路29號","22.811","120.398","Kaohsiung18","2018"
"08BEAC0A02F8","桃園市市立八德國小","桃園市八德區興豐路222號","24.928085","121.2831983","Taoyuan19","2019"
"08BEAC0A0432","臺中市立東華國中","臺中市東勢區東關路五段500號","24.20530925","120.8396155","Taichung19","2019"
"08BEAC09FF14","臺中市立臺中啟明學校","臺中市后里區廣福里三豐路三段936號","24.30478166","120.7232066","Taichung19","2019"
"08BEAC0A03FA","桃園市市立中壢國小","桃園市中壢區中榮里延平路622號","24.9543774","121.2210425","Taoyuan19","2019"
"08BEAC0A0418","桃園市市立中原國小","桃園市中壢區中北路88號","24.95630333","121.2387916","Taoyuan19","2019"
"74DA38C7D490","金門縣立湖埔國小","[892]金門縣金寧鄉湖下196號","24.456","118.308","Kinmen","2017"
"74DA38C7D516","新竹市立虎林國小","[300]新竹市香山區延平路二段78號","24.806","120.941","Hsinchu","2017"
"74DA38F210AA","市立社子國小","臺北市士林區永倫里延平北路六段308號","25.089","121.503","Taipei18","2018"
"74DA38F209B2","屏東縣縣立僑德國小","[940]屏東縣枋寮鄉隆山村僑德路186號","22.363","120.599","Pingtung","2018"
"74DA38F20AF2","高雄市市立民族大愛國小","高雄市民族大愛國小 高雄市杉林區月眉里和氣街15號","22.964","120.539","Kaohsiung18","2018"
"74DA38F21054","高雄市市立新威國小","高雄市新威國小 高雄市六龜區新興里新威212號","22.898","120.627","Kaohsiung18","2018"
"74DA38F20A78","台東縣縣立龍田國小","[955]臺東縣鹿野鄉龍田村光榮路236號","22.904","121.124","Taitung","2018"
"08BEAC0A0090","臺中市立喀哩國小","臺中市烏日區溪南路二段370號","24.06201274","120.6426954","Taichung19","2019"
"74DA38C7D61A","新竹市立青草湖國小","[300]新竹市東區明湖路1211號","24.769","120.978","Hsinchu","2017"
"74DA38F20CA2","新竹縣縣立山崎國小","[304]新竹縣新豐鄉新興路291號","24.877","120.998","HsinchuCounty","2018"
"74DA38F20D36","苗栗縣縣立造橋國中","[361]苗栗縣造橋鄉造橋村1鄰老庄27號","24.639","120.863","Miaoli","2018"
"74DA38F20F90","澎湖縣縣立文澳國小","[880]澎湖縣馬公市西文里文學路221號","23.564","119.583","Penghu","2018"
"74DA38F20C96","高雄市市立小坪國小","高雄市小坪國小 高雄市大樹區小坪路73號","22.681","120.412","Kaohsiung18","2018"
"08BEAC0A014E","臺中市立崇光國小","臺中市大里區大明路181號","24.11457406","120.6850045","Taichung19","2019"
"74DA38F20F5E","市立康寧國小","臺北市內湖區清白里星雲街121號","25.08","121.594","Taipei18","2018"
"74DA38F7C436","新北市深坑國小","N/A","25.001","121.618","NewTaipei18","2018"
"74DA38F2117A","台東縣振興分校","[958]台東縣池上鄉振興村6鄰36號","23.043","121.195","Taitung","2018"
"74DA38F20C98","新竹縣縣立新城國小","[308]新竹縣寶山鄉寶新路二段475號","24.733","120.967","HsinchuCounty","2018"
"74DA38F20D46","新竹縣縣立芎林國小","[307]新竹縣芎林鄉文林村四鄰文山路288號","24.733","121.093","HsinchuCounty","2018"
"08BEAC0A0316","臺南市市立青山國小","臺南市東山區青山里16號","23.2806719","120.4672546","Tainan19","2019"
"74DA38F20932","苗栗縣縣立烏眉國小","[357]苗栗縣通霄鎮烏眉里3鄰39號","24.51","120.72","Miaoli","2018"
"74DA38F20854","宜蘭縣四季國小英士分校","[267]宜蘭縣大同鄉梵梵巷100號","24.612","121.525","Ilan","2018"
"74DA38F21036","新竹縣縣立十興國小","[302]新竹縣竹北市莊敬北路66號","24.823","121.024","HsinchuCounty","2018"
"74DA38C7D606","新竹市立舊社國小","[300]新竹市北區金竹路99號","24.822","120.973","Hsinchu","2017"
"74DA38F7C39C","新北市烏來幼兒園","N/A","24.863","121.547","NewTaipei18","2018"
"74DA38F208CA","宜蘭縣縣立力行國小","[260]宜蘭縣宜蘭市力行路152號","24.763","121.755","Ilan","2018"
"08BEAC0A04B6","臺南市市立大灣國小","臺南市永康區大灣路283號","23.0055065155","120.267425537","Tainan19","2019"
"08BEAC0A0898","桃園市市立大坡國小","桃園市新屋區大坡里五鄰5號","24.95765475","121.0402594","Taoyuan19","2019"
"74DA38ED05B2","花蓮縣立三棧國小","[972]花蓮縣秀林鄉景美村三棧102號","24.102","121.606","Hualien","2018"
"74DA38ED04EC","花蓮縣立瑞穗國小","[978]花蓮縣瑞穗鄉溫泉路一段19號","23.497","121.373","Hualien","2018"
"74DA38F7C56E","新北市三芝國中","N/A","25.259","121.501","NewTaipei18","2018"
"74DA38ED05B0","花蓮縣立馬遠國小","[979]花蓮縣萬榮鄉馬遠村39號","23.576","121.361","Hualien","2018"
"74DA38F20A6A","屏東縣縣立西勢國小","[911]屏東縣竹田鄉西勢村光明路8之1號","22.621","120.525","Pingtung","2018"
"74DA38F20E0A","高雄市市立中芸國中","高雄市立中芸國民中學 高雄市林園區中芸里中芸路3-100號","22.485","120.395","Kaohsiung18","2018"
"08BEAC0A03FC","臺中市立東海國小","臺中市西屯區福聯里國際街75號","24.18456815","120.5929182","Taichung19","2019"
"08BEAC0A0874","桃園市市立山腳國小","桃園市蘆竹區南山路三段440號","25.08838924","121.2875087","Taoyuan19","2019"
"08BEAC0A0876","臺南市市立大成國小","臺南市善化區大成路385號","23.1264379","120.2957977","Tainan19","2019"
"08BEAC09FF16","臺中市立僑忠國小","臺中市潭子區中山路二段31號","24.20236354","120.7032586","Taichung19","2019"
"74DA38F209B6","台東縣縣立三和國小","[963]臺東縣太麻里鄉三和村漁場94號","22.672","121.037","Taitung","2018"
"08BEAC09FF18","臺中市立豐原高商","臺中市豐原區圓環南路50號","24.24657","120.7145","Taichung19","2019"
"74DA38F20E10","新竹縣縣立竹東國小","[310]新竹縣竹東鎮康寧街1號","24.735","121.088","HsinchuCounty","2018"
"74DA38F21058","高雄市市立新民國小","高雄市新民國小 高雄市左營區自由三路478號","22.676","120.313","Kaohsiung18","2018"
"08BEAC0A0878","桃園市市立光明國小","桃園市蘆竹區南興里三鄰南昌路255號","25.04122431","121.2907674","Taoyuan19","2019"
"74DA38F20ADA","屏東縣縣立社皮國小","[913]屏東縣萬丹鄉社口村社皮路2段550號","22.614","120.468","Pingtung","2018"
"08BEAC0A086C","桃園市市立會稽國中","桃園市桃園區大興路222號","25.01745469","121.3126967","Taoyuan19","2019"
"74DA38F207EE","苗栗縣縣立福基國小","[363]苗栗縣公館鄉福基村275號","24.468","120.832","Miaoli","2018"
"74DA38C7D46C","嘉義市立文雅國小","[600]嘉義市東區盧厝里11鄰文雅街2號","23.483","120.487","Chiayi","2017"
"74DA38F20B64","苗栗縣縣立鶴岡國中","[363]苗栗縣公館鄉鶴岡村178號","24.528","120.83","Miaoli","2018"
"74DA38F7C39E","新北市新店幼兒園","N/A","24.987","121.521","NewTaipei18","2018"
"74DA38F2118C","澎湖縣縣立大池國小","[881]澎湖縣西嶼鄉大池村129號","23.614","119.513","Penghu","2018"
"74DA38F7C442","新北市達觀國中","N/A","24.953","121.5","NewTaipei18","2018"
"74DA38F7C31C","新北市安溪國小","N/A","24.93","121.372","NewTaipei18","2018"
"08BEAC09FFF4","臺中市立六寶國小","臺中市大雅區光復路15之2號","24.2387123","120.6358958","Taichung19","2019"
"74DA38F20A8A","屏東縣縣立三多國小","[904]屏東縣九如鄉三塊村三民路307號","22.748","120.485","Pingtung","2018"
"08BEAC0A05D4","嘉義縣縣立新美國小","嘉義縣阿里山鄉新美村四鄰78號","23.33856967","120.6831187","ChiayiCounty19","2019"
"08BEAC0A06F4","臺南市市立安定國中","臺南市安定區安加里262之1號","23.1142768","120.2335345","Tainan19","2019"
"74DA38F20BDA","新竹縣縣立雙溪國小","[308]新竹縣寶山鄉雙園路二段310號","24.765","120.99","HsinchuCounty","2018"
"74DA38F20AFC","高雄市市立鳳甲國中","高雄市立鳳甲國民中學 高雄市新強里鳳山區輜汽路300號","22.616","120.342","Kaohsiung18","2018"
"08BEAC09FFB8","桃園市市立忠貞國小","桃園市平鎮區龍興里龍南路315號","24.92321741","121.2502156","Taoyuan19","2019"
"74DA38F20828","宜蘭縣縣立員山國小","[264]宜蘭縣員山鄉員山村復興路39號","24.743","121.722","Ilan","2018"
"74DA38F20CAE","台東縣縣立岩灣國小","[950]臺東縣臺東市岩灣路50巷401弄11號","22.806","121.124","Taitung","2018"
"74DA38F208D0","宜蘭縣縣立成功國小","[265]宜蘭縣羅東鎮興東南路100號","24.671","121.768","Ilan","2018"
"74DA38F20E8C","苗栗縣縣立卓蘭國小","[369]苗栗縣卓蘭鎮新厝里中山路125號","24.312","120.824","Miaoli","2018"
"74DA38F7C5E2","新北市貢寮國小","N/A","25.021","121.915","NewTaipei18","2018"
"74DA38C7D492","金門縣立正義國小","[891]金門縣金湖鎮正義里成功129號","24.439","118.388","Kinmen","2017"
"74DA38C7D530","新竹市立港南國小","[300]新竹市香山區海埔路171巷91號","24.814","120.922","Hsinchu","2017"
"74DA38F7C444","新北市烏來國中","N/A","24.863","121.553","NewTaipei18","2018"
"74DA38F20BBC","高雄市市立竹圍國小","高雄市竹圍國小 高雄市岡山區竹圍里大仁北路1號","22.803","120.302","Kaohsiung18","2018"
"08BEAC0A02D4","雲林縣縣立中溪國小","雲林縣虎尾鎮頂溪里過溪路六四號","23.72657902","120.4635585","Yunlin19","2019"
"08BEAC0A03E0","桃園市市立三和國小","桃園市龍潭區龍新路三和段1356號","24.8481239687","121.16799362","Taoyuan19","2019"
"08BEAC0A02D6","嘉義縣縣立網寮國小","嘉義縣東石鄉網寮村27號","23.431384","120.156914","ChiayiCounty19","2019"
"74DA38F211BA","屏東縣縣立舊寮國小","[906]屏東縣高樹鄉舊寮村長美路42號","22.848","120.61","Pingtung","2018"
"74DA38F208BA","宜蘭縣縣立三星國小","[266]宜蘭縣三星鄉三星路五段86號","24.666","121.65","Ilan","2018"
"74DA38F7C44A","新北市三峽國小","N/A","24.935","121.367","NewTaipei18","2018"
"08BEAC0A00DC","臺南市市立東山國小","臺南市東山區東中里青葉路二段49號","23.3232545761","120.404803567","Tainan19","2019"
"74DA38F20B66","苗栗縣縣立建國國小","[351]苗栗縣頭份市建國路80號","24.695","120.912","Miaoli","2018"
"74DA38F208E0","宜蘭縣縣立南安國小","[270]宜蘭縣蘇澳鎮南建里學府路122號","24.579","121.868","Ilan","2018"
"74DA38F207EC","苗栗縣縣立大同國小","[360]苗栗縣苗栗市高苗里大同路80號","24.552","120.814","Miaoli","2018"
"74DA38ED0630","花蓮縣立明廉國小","[970]花蓮縣花蓮市中山路903號","23.994","121.594","Hualien","2018"
"74DA38F7C44C","新北市中泰國小","N/A","25.224","121.484","NewTaipei18","2018"
"74DA38F20848","宜蘭縣縣立七賢國小","[264]宜蘭縣員山鄉浮洲路30號","24.719","121.743","Ilan","2018"
"74DA38F20B08","高雄市市立興中國小","高雄市興中國小 高雄市桃源區高中里興中巷44號","23.128","120.718","Kaohsiung18","2018"
"74DA38F20952","新竹縣縣立鳳岡國中","[302]新竹縣竹北市大義里鳳岡路三段100號","24.864","120.965","HsinchuCounty","2018"
"74DA38F20B9E","苗栗縣縣立客庄國小","[358]苗栗縣苑裡鎮客庄里新興路21號","24.439","120.654","Miaoli","2018"
"74DA38F20F10","高雄市市立吉東國小","高雄市吉東國小 高雄市美濃區吉東里吉頂19號","22.853","120.546","Kaohsiung18","2018"
"74DA38F2100A","高雄市市立廣興國小","高雄市廣興國小 高雄市美濃區興隆里廣興街124號","22.917","120.567","Kaohsiung18","2018"
"08BEAC0A043A","桃園市市立信義國小","桃園市中壢區信義里成都路55號","24.95082166","121.2316066","Taoyuan19","2019"
"74DA38F20FDC","屏東縣縣立鹽洲國小","[932]屏東縣新園鄉鹽埔村鹽洲路379號","22.488","120.44","Pingtung","2018"
"08BEAC09FF2A","桃園市市立富台國小","桃園市中壢區中山東路三段369號","24.94210666","121.252075","Taoyuan19","2019"
"74DA38F20E5A","宜蘭縣縣立四季國小","[267]宜蘭縣大同鄉四季村和勳巷1號","24.488","121.426","Ilan","2018"
"74DA38F208F4","苗栗縣縣立鯉魚國小","[367]苗栗縣三義鄉鯉魚潭村上山下24號","24.343","120.767","Miaoli","2018"
"08BEAC0A0048","臺中市立岸裡國小","臺中市神岡區岸裡里中山路52號","24.24967999","120.6968633","Taichung19","2019"
"74DA38F7C61A","市立光復國小","臺北市信義區光復南路271號","25.041","121.565","Taipei18","2018"
"08BEAC0A0236","臺中市立豐村國小","42084臺中市豐原區水源路341號","24.25523866","120.7364315","Taichung19","2019"
"74DA38F2087E","宜蘭縣大同國小松羅分校","[267]宜蘭縣大同鄉松羅南巷88號","24.656","121.578","Ilan","2018"
"74DA38F20DE4","高雄市市立前鎮國小","高雄市前鎮國小 高雄市前鎮區新生路200號","22.586","120.308","Kaohsiung18","2018"
"08BEAC0A046A","臺南市市立佳里國小","臺南市佳里區安西里公園路445號","23.16435098","120.1718527","Tainan19","2019"
"08BEAC0A033C","嘉義縣縣立下楫國小","嘉義縣東石鄉下楫村147號","23.4920008","120.1871593","ChiayiCounty19","2019"
"74DA38F20E5E","苗栗縣縣立溪洲國小","[356]苗栗縣後龍鎮溪洲里87之3號","24.62","120.777","Miaoli","2018"
"74DA38F20FDA","高雄市市立文府國小","高雄市文府國小 高雄市左營區文府路399號","22.692","120.314","Kaohsiung18","2018"
"74DA38F2099C","屏東縣縣立新興國小","[913]屏東縣萬丹鄉灣內村聖賢路241號","22.57","120.458","Pingtung","2018"
"08BEAC0A0652","雲林縣縣立頂湖國小","雲林縣口湖鄉頂湖村一二一號","23.6004601","120.1794486","Yunlin19","2019"
"08BEAC0A0434","雲林縣縣立僑美國小","雲林縣北港鎮草湖里華勝路六五五號","23.5930461","120.3017378","Yunlin19","2019"
"74DA38C7D628","新竹市立龍山國小","[300]新竹市東區光復路一段574號","24.79","121.007","Hsinchu","2017"
"08BEAC0A047E","臺南市市立龍崎國中","臺南市龍崎區新市子258號","22.96851238","120.3609613","Tainan19","2019"
"08BEAC0A01A6","臺中市立協成國小","臺中市新社區協成里興義街219號","24.19350258","120.8124575","Taichung19","2019"
"08BEAC0A0104","臺中市立甲南國小","臺中市清水區臨海路26號","24.30474724","120.5955373","Taichung19","2019"
"08BEAC09FFFA","臺南市市立五王國小","臺南市永康區中華二路150號","23.0085611","120.2367644","Tainan19","2019"
"74DA38F20CC8","屏東縣縣立忠孝國小","[900]屏東縣屏東市建豐路204號","25.062","121.451","Pingtung","2018"
"74DA38F20C9E","新竹縣縣立五龍國小","[307]新竹縣芎林鄉五龍村105號","24.737","121.123","HsinchuCounty","2018"
"08BEAC0A0340","臺中市立上石國小","臺中市西屯區西屯路二段上石南六巷25號","24.173657","120.643326","Taichung19","2019"
